"the-beatles","help","rock","Help, I need somebody Help, not just anybody Help, you know I need someone Help! When I was younger, so much younger than today I never needed anybody's help in any way But now these days are gone I'm not so self-assured Now I find I've changed my mind and opened up the doors Help me if you can, I'm feeling down And I do appreciate you being 'round Help me get my feet back on the ground Won't you please, please help me? And now my life has changed in oh so many ways My independence seems to vanish in the haze But every now and then I feel so insecure I know that I just need you like I've never done before Help me if you can, I'm feeling down And I do appreciate you being 'round Help me get my feet back on the ground Won't you please, please help me? When I was younger, so much younger than today I never needed anybody's help in any way But now these days are gone I'm not so self-assured Now I find I've changed my mind, I've opened up the doors Help me if you can, I'm feeling down And I do appreciate you being 'round Help me get my feet back on the ground Won't you please, please help me? Help me, help me, ooo"
"the-beatles","santa_claus_is_coming_to_town","rock","You better watch out  You better not cry  You better not pout  I'm telling you why  Santa Claus  Is coming to town  Santa Claus  Is coming to town  Santa Claus  Is coming to town  He's making a list  He's checking it twice  He's gonna find out  Who's naughty or nice  Santa Claus  Is coming to town  Santa Claus  Is coming to town  Santa Claus  Is coming to town  He sees you  When you're sleeping  He knows  When you're awake  He knows  If you've been bad  Or good  So be good  For goodness sake  So you  Better watch out  You better not cry  You better not pout  I'm telling you why  Santa Claus  Is coming to town  Santa Claus  Is coming to town  Santa Claus  Is coming to town  The kids in girl  And boyland  Will have a jubilee  They're gonna build  A toyland  All around  The Christmas tree  So you  Better watch out  You better not cry  You better not pout  I'm telling you why  Santa Claus  Is coming to town  Santa Claus  Is coming to town  Santa Claus  Is coming  Santa Claus  Is coming to town  Santa Claus  Is coming to town"
"the-beatles","a_day_in_the_life","rock","I read the news today oh boy  About a lucky man who made the grade  And though the news was rather sad  Well I just had to laugh  I saw the photograph.  He blew his mind out in a car  He didn't notice that the lights had changed  A crowd of people stood and stared  They'd seen his face before  Nobody was really sure  If he was from the House of Lords.  I saw a film today oh boy  The English army had just won the war  A crowd of people turned away  But I just had to look  Having read the book  I'd love to turn you on.  Woke up, fell out of bed,  Dragged a comb across my head  Found my way downstairs and drank a cup,  And looking up I noticed I was late.  Found my coat and grabbed my hat  Made the bus in seconds flat  Found my way upstairs and had a smoke,  Somebody spoke and I went into a dream.  I read the news today oh boy  Four thousand holes in Blackburn, Lancashire  And though the holes were rather small  They had to count them all  Now they know how many holes it takes to fill the Albert Hall.  I'd love to turn you on "
"the-beatles","getting_better","rock","It's getting better all the time I used to get mad at my school (No I can't complain) The teachers who taught me weren't cool (No I can't complain) You're holding me down (Oh), turning me round (Oh) Filling me up with your rules (Foolish rules) I've got to admit it's getting better (Better) A little better all the time (It can't get more worse) I have to admit it's getting better (Better) It's getting better since you've been mine Me used to be angry young man Me hiding me head in the sand You gave me the word, I finally heard I'm doing the best that I can I've got to admit it's getting better (Better) A little better all the time (It can't get more worse) I have to admit it's getting better (Better) It's getting better since you've been mine Getting so much better all the time It's getting better all the time Better, better, better It's getting better all the time Better, better, better I used to be cruel to my woman I beat her and kept her apart from the things that she loved Man I was mean but I'm changing my scene And I'm doing the best that I can (Ooh) I admit it's getting better (Better) A little better all the time (It can't get more worse) Yes I admit it's getting better (Better) It's getting better since you've been mine Getting so much better all the time It's getting better all the time Better, better, better It's getting better all the time Better, better, better Getting so much better all the time "
"the-beatles","kansas_city__heyheyheyhey__anthology_1_version__medley","rock","Ah, Kansas City Gonna get my baby back home Yeah, yeah I'm gonna Kansas city Gonna get my baby back home Yeah, yeah Well, it's a long, long, time Since my baby's been gone Ah, Kansas City Gonna to get my baby on time Yeah, yeah I'm gonna Kansas City Gonna get my baby on time Yeah, yeah It's just a one, two, three, four Five, six, seven, eight, nine, wah Hey, hey, hey, hey Hey, baby, woo no clown I say you're no clown Now, now, now, now Tell me baby What's been wrong with you Hey, hey, hey, hey Hey, now baby, woo no clown I say you're no clown Now, now, now, now Tell me baby What's been wrong with you Well, I'll say bye Bye, bye, baby bye, bye Oh, so long Bye, bye, baby I'm gone Yeah, I said Bye, bye, baby, bye, bye Bye, bye, bye, bye Well, I'll say bye Bye, bye, baby bye, bye"
"the-beatles","happiness_is_a_warm_gun__anthology_3_version","rock","I need a fix 'cause I'm going down Back to the bits that I left uptown I need a fix 'cause I'm going down Mother Superior jump. . . (Oh shit, wrong chord) I need a fix 'cause I'm going down Back to the bits that I left uptown I need a fix 'cause I'm going down Mother Superior jump the gun Mother Superior jump the gun Yoko Ono, oh no Yoko Ono, oh yes I need a fix 'cause I'm going down Back to the bits that I left uptown I need a fix 'cause I'm going down Mother Superior jump the gun Mother Superior jump the gun Mother Superior jump the gun Mother Superior jump the gun Mother Superior jump the gun Mother Superior jump the gun Mother Superior jump the gun Mother Superior jump the gun Mother Superior jump the gun"
"the-beatles","helter_skelter__anthology_3_version","rock","do you, don't you want me to love you? (I'm) coming down fast but miles above you tell me, tell me, tell me the answer (you) may be a lover but you ain't no dancer do you, don't you want me to make you? (I'm) coming down fast but don't let me break you tell me, tell me, tell me the answer you may be a lover but you ain't no dancer when I get to the bottom I go back to the top of the ride and I know as I get that I never get high but I (zip) to the bottom and I see you again yeah yeah yeah do you, don't you want me to love you? I'm coming down fast but miles above you tell me, tell me, tell me the answer may be a lover but you ain't no dancer dancer, dancer, dancer, dancer yeah look out now, helter skelter hell for leather hell for leather ow, woo look out now, helter skelter helter skelter helter skelter"
"the-beatles","junk__anthology_3_version","rock","Motor cars, handle bars, Bicycles for two. Broken hearted jubilee. Parachutes, army boots, Sleeping bags for two. Sentimental jamboree. Buy! buy! Says the sign in the shop window. Why? why? Says the junk in the yard. Da da ya da da da, Da da da, Da da ya da da, Da da da da da da da. Candlesticks, building bricks, Something old and new. Memories for you and me. Buy! buy! Says the sign in the shop window. Why? why? Says the junk in the yard."
"the-beatles","piggies__anthology_3_version","rock","Have you seen the little piggies Crawling in the dirt? And for all the little piggies Life is getting worse Always having dirt to play around in Have you seen the bigger piggies In their starched white shirts? You will find the bigger piggies Stirring up the dirt Always have clean shirts to play around in In their styes with all their backing They don't care what goes on around In their eyes there's something lacking What they need's a damn good whacking Everywhere there's lots of piggies Living piggy lives You can see them out for dinner With their piggy wives Clutching forks and knives to (eat) their pork-chops"
"the-beatles","honey_pie__anthology_3_version","rock","Oh honey pie My position is tragic Come and show me the magic Of your Hollywood song Now Honey Pie You are driving me frantic Sail across the Atlantic To be where you belong You became a legend of the silver screen Now you're Da da da Now Honey Pie You are driving me frantic Sail across the Atlantic To be where you belong"
"the-beatles","dont_pass_me_by__anthology_3_version","rock","I listen for your footsteps Coming up the drive Listen for your footsteps But they don't arrive Waiting for your knock, dear On my old front door I don't hear it Does it mean you don't love me any more? I hear the clock are ticking On the mantel shelf See the hands are moving But I'm by myself I wonder where you are tonight And why I'm by myself I don't see you Does it mean you don't love me any more? Don't pass me by, don't make me cry, don't make me blue Cause you know darling I love only you You'll never know it hurt me so How I hate to see you go Don't pass me by, don't make me cry, don't make me blue I'm sorry that I doubted you I was so unfair You were in a car crash And you lost your hair You said that you would be late About an hour or two I said that's alright I'm waiting here Just waiting to hear from you Don't pass me by, don't make me cry, don't make me blue Cause you know darling I love only you You'll never know it hurt me so How I hate to see you go Don't pass me by, don't make me cry"
"the-beatles","obladi_oblada__anthology_3_version","rock","Desmond has a barrow in the market place Molly is the singer in a band Desmond says to Molly: \"Girl, I like your face\" And Molly says this as she takes him by the hand. O-bla-di, O-bla-da, life goes on bra Lala how the life goes on O-bla-di, O-bla-da, life goes on bra Lala how the life goes on. Desmond takes a trolly to the jewellers stores Buys a twenty carat golden ring Takes it back to Molly waiting at the door And as he gives it to her she begins to sing. O-bla-di, O-bla-da, life goes on bra Lala how the life goes on O-bla-di, O-bla-da, life goes on bra Lala how the life goes on. In a couple of years they have built a home sweet home With a couple of kids running in the yard Of Desmond and Molly Jones. Happy ever after in the market place Desmond lets the children lend a hand Molly stays at home and does her pretty face And in the evening she's a singer with the band. O-bla-di, O-bla-da, life goes on bra Lala how the life goes on O-bla-di, O-bla-da, life goes on bra Lala how the life goes on. In a couple of years they have built a home sweet home With a couple of kids running in the yard Of Desmond and Molly Jones. Happy ever after in the market place Desmond lets the children lend a hand Molly stays at home and does his pretty face And in the evening she's a singer with the band. O-bla-di, O-bla-da, life goes on bra Lala how the life goes on O-bla-di, O-bla-da, life goes on bra Lala how the life goes on. O-bla-di-bla-da."
"the-beatles","good_night__anthology_3_version","rock","Dream sweet dreams for me Dream sweet dreams for you. Now it's time to say good night Good night sleep tight. Now the sun turns out his light Good night sleep tight. Dream sweet dreams for me Dream sweet dreams for you. Close your eyes and I'll close mine Good night sleep tight. Now the moon begins to shine Good night sleep tight. Dream sweet dreams for me Dream sweet dreams for you."
"the-beatles","blackbird__anthology_3_version","rock","Blackbird singing in the dead of night Take these broken wings and learn to fly All your life You were only waiting for this moment to arise Blackbird singing in the dead of night Take these sunken eyes and learn to see All your life You were only waiting for this moment to be free Blackbird fly, Blackbird fly Into the light of the dark black night Blackbird singing in the dead of night Take these broken wings and learn to fly All your life You were only waiting for this moment to arise Blackbird fly, Blackbird fly Into the light of the dark black night All your life You were only waiting for this moment to arise You were only waiting for this moment to arise"
"the-beatles","while_my_guitar_gently_weeps__anthology_3_version","rock","I look at you all see the love there that's sleeping While my guitar gently weeps I look at the floor and I see it needs sweeping Still my guitar gently weeps I don't know why nobody told you How to unfold your love I don't know how someone controlled you They bought and sold you I look at the world and I notice it's turning While my guitar gently weeps With every mistake we must surely be learning Still my guitar gently weeps I don't know how you were diverted You were perverted too I don't know how you were inverted No one alerted you I look from the wings at the play you are staging While my guitar gently weeps As I'm sitting here doing nothing but aging Still my guitar gently weeps"
"the-beatles","hey_jude__anthology_3_version","rock","Hey Jude, don't make it bad Take a sad song and make it better Remember to let her into your heart Then you can start to make it better Hey Jude, don't be afraid You were made to go out and get her The minute you let her under your skin Then you begin to make it better And anytime you feel the pain, hey Jude, refrain Don't carry the world upon your shoulders For well you know that it's a fool who plays it cool By making his world a little colder Nah nah nah nah nah nah nah nah nah Hey Jude, don't let me down You have found her, now go and get her Remember to let her into your heart Then you can start to make it better So let it out and let it in, hey Jude, begin You're waiting for someone to perform with And don't you know that it's just you, hey Jude, you'll do The movement you need is on your shoulder Nah nah nah nah nah nah nah nah nah yeah Hey Jude, don't make it bad Take a sad song and make it better Remember to let her under your skin Then you'll begin to make it Better better better better better better, oh Nah nah nah nah nah nah, nah nah nah, hey Jude Nah nah nah nah nah nah, nah nah nah, hey Jude Nah nah nah nah nah nah, nah nah nah, hey Jude Nah nah nah nah nah nah, nah nah nah, hey Jude Nah nah nah nah nah nah, nah nah nah, hey Jude Nah nah nah nah nah nah, nah nah nah, hey Jude Nah nah nah nah nah nah, nah nah nah, hey Jude Nah nah nah nah nah nah, nah nah nah, hey Jude Nah nah nah nah nah nah, nah nah nah, hey Jude Nah nah nah nah nah nah, nah nah nah, hey Jude Nah nah nah nah nah nah, nah nah nah, hey Jude Nah nah nah nah nah nah, nah nah nah, hey Jude Nah nah nah nah nah nah, nah nah nah, hey Jude Nah nah nah nah nah nah, nah nah nah, hey Jude Nah nah nah nah nah nah, nah nah nah, hey Jude Nah nah nah nah nah nah, nah nah nah, hey Jude"
"the-beatles","not_guilty__anthology_3_version","rock","Not guilty For getting in your way, while you try to steal the day Not guilty I'm not nodding for the rest, I'm not trying to steal you vest I end up trying to be smart I only want what I can get I'm really sorry for your aging head, but like you heard me said Not guilty Though you signing me a writ, while I'm trying to do my bit I don't expect to take your hoard I only want what I can get I'm really sorry that you're underfed, but like you heard me said Not guilty Not guilty For looking like a freak, making friends with every Sikh Not guilty For leading you astray, on the road to Masalay I won't upset the apple cart I only want what I can get I'm really sorry that you've been mislead, but like you heard me said Not guilty"
"the-beatles","mother_natures_son__anthology_3_version","rock","Born a poor young country boy Mother Nature's son All day long I'm sitting singing songs for everyone. Sit beside a mountain stream See her waters rise Listen to the pretty sound of music as she flies. Find me in my field of grass Mother Nature's son Swaying daisies sing a lazy song beneath the sun. Mother Nature's son."
"the-beatles","whats_the_new_mary_jane__anthology_3_version","rock","She looks as an African Queen She eating twelve chapattis and cream She tastes as Mongolian lamb She coming from out of Bahran What a shame Mary Jane had a pain at the party What a shame Mary Jane what a shame Mary Jane had a pain at the party She like to be married with Yetti He groving such cooky spagetti She jumping as Mexican bean To make that her body morphine What a shame Mary Jane had a pain at the party What a shame Mary Jane what a shame Mary Jane had a pain at the party She catch Patagonian pancake With that one and gin party makes She having always good contact She making with Apple and contract What a shame Mary Jane had a pain at the party What a shame Mary Jane what a shame Mary Jane had a pain at the party All together now What a shame Mary Jane had a pain at the party What a shame what what a shame Mary Jane had a pain at the party What a shame what a shame what a shame what a shame Mary Jane had a pain at the party What a shame what a shame what a shame what a shame Mary Jane had a pain at the party What a shame what a shame Mary Jane had a pain at the party What a shame what a shame what a shame Mary Jane had a pain at the party What a shame Mary Jane Mary Jane had a pain at the party What a shame Mary Jane what a shame Mary Jane had a pain at the party What a shame Mary Jane what a shame She looks as an African Queen She tastes as Mongolian lamb What a shame Mary Jane what a shame Mary Jane had a pain at the party All together now What a shame Mary Jane had a pain at the party What a shame what what a shame Mary Jane had a pain at the party What a shame what a shame what a shame what a shame (That's it. Before we got taking no what)"
"the-beatles","step_inside_love__los_paranoias__anthology_3_version","rock","Step inside love and stay, Step inside love. Step inside love. Step inside love. I want you to stay. You look tired, love, let me turn down the light. Come in out of the cold, rest your head on my shoulder and kiss me tonight. We are together now and forever, come my way. Step inside love and stay, step inside love, step inside love, step inside love, I want you to stay. Joe Prairies and the Prairie Wallflowers. Los Paranoias. Los Paranoias invites you to to just enjoy us. Come on you can do with baby, come on and join Los Paranoias. Just enjoy us. Los Paranoias, Los Paranoias. Come on and enjoy us. Harmony. Los Paranoias, come on and enjoy us. We're Los Paranoias. We're here to sing for you and whatever you want us to we will sing a little song for you."
"the-beatles","im_so_tired__anthology_3_version","rock","One, two, three I¥m so tired I haven¥t slept a wink I¥m so tired My mind is on the blink I wonder should I get up And fix myself a drink No, no, no I¥m so tired I don¥t know what to do I¥m so tired My mind is set on you I wonder should I call you But I know what you would do You say I¥m putting you on But it¥s not joke It¥s doing me harm You know I can¥t sleep I can¥t stop my brain You know it¥s three weeks I¥m going insane You know I give you everything I had For little piece of mine I¥m so tired I¥m feeling so upset Although I¥m so tired I have another cigarrete And curse Sir Walter Raleigh It was just a stupid git You say It¥s doing me wrong But it¥s no joke It¥s doing me harm You know I can¥t sleep I can¥t stop my brain You know it¥s three weeks I¥m going insane I give you everything I got For little piece of mine I give you everything I got For little piece of mine I give you everything I got For little piece of mine"
"the-beatles","i_will__anthology_3_version","rock","Who knows how long I¥ve love you (Yeah) You know I love you still Will I wait a lonely lifetime If you want me to, I will You know if I ever saw you I didn¥t catch your name But it never really matter I will always feel the same Love you forever and forever Love you with all my heart Love you whenever we¥re together Love you with all my heart And when at last I find you Your song will fill the air Read it loud So I can hear you Make it easy to be near you For the things you do And dear me to you Oh, you know I will I will Da da da da da, da da da da Da da da da da da da"
"the-beatles","why_dont_we_do_it_in_the_road__anthology_3_version","rock","Why don¥t we do it in the road? Why don¥t we do it in the road? Why don¥t we do it in the road? Why don¥t we do it in the road? No one will be watching us Why don¥t we do it in the road? Why don¥t we do it in the road? Why don¥t we do it in the road? Why don¥t we do it in the road? Yeah, Why don¥t we do it in the road? No one will be watching us Why don¥t we do it in the road? Why don¥t we do it in the road? Why don¥t we do it in the road? Why don¥t we do it in the road? Why don¥t we do it in the road? No one will be watching us Why don¥t we do it in the road? Why don¥t we do it in the road? Why don¥t we do it in the road? Why don¥t we do it in the road? Why don¥t we do it in the road? People won¥t be watching us Why don¥t we do it in the road? Why don¥t we do it in the road?"
"the-beatles","julia__anthology_3_version","rock","Half of what I¥ll say is meaninless But I¥ll say it just to reach you, Ju... Julia (ha, ha, ha) (It was till then...) (But it was almost there) (Couldn¥t I go from there?) (No, cause almost perfect, huh?)"
"the-beatles","two_of_us__anthology_3_version","rock","Ok, Paul is dead. A little of guitar. Two of us riding nowhere Spending someone's Hard earned pay You and me Sunday driving Not arriving On our way back home We're on our way home We're on our way home We're going home Two of us sending postcards Writing letters On my wall You and me burning matches Lifting latches On our way back home We're on our way home We're on our way home We're going home You and I have memories Longer than the road that stretches out ahead Two of us wearing raincoats Standing so low In the sun You and me chasing paper Getting nowhere On our way back home We're on our way home We're on our way home We're going home You and I have memories Longer than the road that stretches out ahead Two of us wearing raincoats Standing so low In the sun You and me chasing paper Getting nowhere On our way back home We're on our way home We're on our way home We're going home"
"the-beatles","for_you_blue__anthology_3_version","rock","Because you're sweet and lovely girl, I love you Because you're sweet and lovely girl, I do I love you more than ever girl, it's true I want you in the morning girl, I love you I want you at the moments I feel blue I'm living every moment girl for you I've loved you from the moment that I saw you You looked at me that's all you had to do I feel it now, I hope you feel it too Because you're sweet and lovely girl, I love you Because you're sweet and lovely girl, it's true I love you more each moment I'm with you"
"the-beatles","the_long_and_winding_road__anthology_3_version","rock","The long and winding road that leads to your door Will never disappear I've seen that road before it always leads me here Leads me to your door The wild and windy night that the rain washed away Has left a pool of tears crying for the day Why leave me standing here, let me know the way Many times I've been alone and many times I've cried Anyway you'll never know the many ways I've tried And still they lead me back to the long and winding road You left me standing here a long, long time ago Don't leave me waiting here, lead me to you door But still they lead me back to the long and winding road You left me standing here a long, long time ago Don't keep me waiting here (Don't keep me wait), lead me to you door Yeah, yeah, yeah, yeah"
"the-beatles","all_things_must_pass__anthology_3_version","rock","Sunrise doesn't last all morning A cloudburst doesn't last all day Seems my love is up And has left you with no warning It's not always be this grey All things must pass All things must pass away Sunset doesn't last all evening A mind can blow those clouds away After all this my love is up And must be leaving It's not always been this grey All things must pass All things must pass away All things must pass None of life's strings can last So I must be on my way And face another day And the darkness only stays at nighttime In the morning it will fade away Daylight is good At arriving at the right time It's not always gonna be this grey All things must pass All things must pass away All things must pass All things must pass away"
"the-beatles","get_back__anthology_3_version","rock","Jojo was a man who thought he was a loner But he knew it wouldn't last Jojo left his home in Tucson, Arizona For some California grass Get back, get back Get back to where you once belonged Get back, get back Get back to where you once belonged Get back Jojo Go home Get back, get back Get back to where you once belonged Get back, get back Get back to where you once belonged Get back Jo Sweet Loretta Martin thought she was a woman But she was another man All the girls around her say she's got it coming But she gets it while she can Get back, get back Get back to where you once belonged Get back, get back Get back to where you once belonged Get back Loretta Go home Get back, get back Get back to where you once belonged Get back, get back Get back to where you once belonged Get back Woo..."
