"the-beatles","the_beatles__in_my_life","rock","There are places I remember All my life, though some have changed Some forever not for better Some have gone and some remain All these places had their moments With lovers and friends, I still can recall Some are dead and some are living In my life I've loved them all But of all these friends and lovers There is no one compares with you And these memories lose their meaning When I think of love as something new Though I know I'll never lose affection For people and things that went before I know I'll often stop and think about them In my life I love you more Though I know I'll never lose affection For people and things that went before I know I'll often stop and think about them In my life I love you more, in my life I love you more"
"the-beatles","you_really_got_a_hold_on_me","rock","I don't like you But I love you Seems that I'm always Thinking of you Oh, you treat me badly I love you madly You've really got a hold on me (You really got a hold on me) You really got a hold on me (You really got a hold on me) Baby, I don't want you But I need you Don't want to kiss you But I need to Oh, you do me wrong now My love is strong now You've really got a hold on me (You really got a hold on me) You really got a hold on me (You really got a hold on me) Baby, I love you and all that I want you to do Is just hold me, hold me, hold me, hold me Tighter Tighter I want to leave you Don't want to stay here Don't want to spend Another day here Oh, I want to split now I just can't quit now You've really got a hold on me (You really got a hold on me) You really got a hold on me (You really got a hold on me) Baby, I love you and all that I want you to do Is just hold me (please), hold me (squeeze), hold me, hold me You've really got a hold on me (You really got a hold on me) You've really got a hold on me (You really got a hold on me)"
"the-beatles","all_you_need_is_love","rock","(Love, love, love) (Love, love, love) (Love, love, love) There's nothing you can do that can't be done Nothing you can sing that can't be sung Nothing you can say but you can learn how to play the game It's easy There's nothing you can make that can't me made No one you can save that can't be saved Nothing you can do but you can learn how to be you in time It's easy All you need is love All you need is love All you need is love, love Love is all you need (Love, love, love) (Love, love, love) (Love, love, love) All you need is love All you need is love All you need is love, love Love is all you need There's nothing you can know that isn't known Nothing you can see that isn't shown There's nowhere you can be that isn't where you're meant to be It's easy All you need is love All you need is love All you need is love, love Love is all you need All you need is love, all together now All you need is love, everybody All you need is love, love Love is all you need Love is all you need Love is all you need Love is all you need ..."
"the-beatles","here_comes_the_sun","rock","Here comes the sun Here comes the sun, and I say It's all right Little darling It's been a long, cold lonely winter Little darling It feels like years since it's been here Here comes the sun Here comes the sun, and I say It's all right Little darling The smiles returning to the faces Little darling It seems like years since it's been here Here comes the sun Here comes the sun, and I say It's all right Sun, sun, sun, here it comes Sun, sun, sun, here it comes Sun, sun, sun, here it comes Sun, sun, sun, here it comes Sun, sun, sun, here it comes Little darling I feel that ice is slowly melting Little darling It seems like years since it's been clear Here comes the sun Here comes the sun, and I say It's all right Here comes the sun Here comes the sun It's all right It's all right"
"the-beatles","here_comes_the_sun_harrison","rock","The Beatles Miscellaneous Here Comes The Sun (Harrison) Here comes the sun, here comes the sun, and I say it's all right Little darling, it's been a long cold lonely winter Little darling, it feels like years since it's been here Here comes the sun, here comes the sun and I say it's all right Little darling, the smiles returning to the faces Little darling, it seems like years since it's been here Here comes the sun, here comes the sun and I say it's all right Sun, sun, sun, here it comes... Sun, sun, sun, here it comes... Sun, sun, sun, here it comes... Sun, sun, sun, here it comes... Sun, sun, sun, here it comes... Little darling, I feel that ice is slowly melting Little darling, it seems like years since it's been clear Here comes the sun, here comes the sun, and I say it's all right It's all right"
"the-beatles","good_morning_good_morning","rock","Good morning, good morning Good morning, good morning Good morning, a Nothing to do To save his life Call his wife in Nothing to say But what a day How's your boy been? Nothing to do It's up to you I've got nothing to say But it's O.K. Good morning, good morning Good morning, a Going to work Don't want to go Feeling lowdown Heading for home You start to roam Then you're in town Everybody knows There's nothing doing Everything is closed It's like a ruin Everyone you see Is half asleep And you're on your own You're in the street After a while You start to smile Now you feel cool Then you decide To take a walk By the old school Nothing has changed It's still the same I've got nothing to say But it's O.K. Good morning, good morning Good morning, a People running 'round It's five o'clock Everywhere in town It's getting dark Everyone you see Is full of life It's time for tea And meet the wife Somebody needs To know the time Glad that I'm here Watching the skirts You start to flirt No you're in gear Go to a show You hope she goes I've got nothing to say But it's O.K. Good morning, good morning good Good morning, good morning good Good morning, good morning good ‚Ä¶"
"the-beatles","money_thats_what_i_want_ep","rock","The best things in life are free But you can keep them for the birds and bees Now give me money That's what I want That's what I want, yeah That's what I want You're lovin' gives me a thrill But you're lovin' don't pay my bills Now give me money That's what I want That's what I want, yeah That's what I want Money don't get everything it's true What it don't get, I can't use Now give me money That's what I want That's what I want, yeah That's what I want, wah Money don't get everything it's true What it don't get, I can't use Now give me money That's what I want That's what I want, yeah That's what I want Well now give me money A lot of money Wow, yeah, I wanna be free Oh I want money That's what I want That's what I want, well Now give me money A lot of money Wow, yeah, you need money Now, give me money That's what I want, yeah That's what I want"
"the-beatles","anna_go_to_him_ep","rock","Anna You come and ask me, girl To set you free, girl You say he loves you more than me So I will set you free Go with him Go with him Anna Girl, before you go now I want you to know, now That I still love you so But if he loves you more Go with him All of my life I've been searching for a girl To love me like I love you Oh, now, but every girl I've ever had Breaks my heart and leaves my sad What am I, what am I supposed to do Anna Just one more thing, girl You give back your ring to me, and I will set you free Go with him Anna Just one more thing, girl You give back your ring to me, and I will set you free Go with him"
"the-beatles","sgt_peppers_lonely_hearts_club_band","rock","It was twenty years ago today Sgt. Pepper taught the band to play They've been going in and out of style But they're guaranteed to raise a smile So may I introduce to you The act you've known for all these years Sgt. Pepper's Lonely Hearts Club Band We're Sgt. Pepper's Lonely Hearts Club Band We hope you will enjoy the show Sgt. Pepper's Lonely Hearts Club Band Sit back and let the evening go Sgt. Pepper's lonely, Sgt. Pepper's lonely Sgt. Pepper's Lonely Hearts Club Band It's wonderful to be here It's certainly a thrill You're such a lovely audience We'd like to take you home with us We'd love to take you home I don't really want to stop the show But I thought that you might like to know That the singer's going to sing a song And he wants you all to sing along So let me introduce to you the one and only Billy Shears And Sgt. Pepper's Lonely Hearts Club Band, Billy Shears"
"the-beatles","within_you_without_you","rock","We were talking About the space between us all And the people who hide themselves Behind a wall of illusion Never glimpse the truth Then it's far too late When they pass away We were talking About the love we all could share When we find it To try our best to hold it there With our love, with our love We could save the world If they only knew Try to realize it's all within yourself No one else can make you change And to see you're really only very small And life flows on within you and without you We were talking About the love that's gone so cold And the people who gain the world And lose their soul They don't know, they can't see Are you one of them When you've seen beyond yourself Then you may find Peace of mind is waiting there And the time will come When you see we're all one And life flows on within you and without you"
"the-beatles","tell_me_why_ep","rock","Tell me why you cried, and why you lied to me Tell me why you cried, and why you lied to me Well I gave you everything I had But you left me sitting on my own Did you have to treat me oh so bad All I do is hang my head and moan Tell me why you cried, and why you lied to me Tell me why you cried, and why you lied to me If there's something I have said or done Tell me what and I'll apologise If you don't really can't go on Holding back these tears in my eyes Tell me why you cried, and why you lied to me Tell me why you cried, and why you lied to me Well I beg you on my bended knees If you'll only listen to my pleas Is there anything I can do Cos I really can't stand it, I'm so in love with you Tell me why you cried, and why you lied to me Tell me why you cried, and why you lied to me"
"the-beatles","free_as_a_bird","rock","Free as a bird It's the next best thing to be Free as a bird Home, home and dry Like a homing bird I'll fly As a bird on wings Whatever happened to The life that we once knew? Can we really live without each other? Where did we lose the touch That seemed to mean so much? It always made me feel so Free as a bird Like the next best thing to be Free as a bird Home, home and dry Like a homing bird I'll fly As a bird on wings Whatever happened to The life that we once knew? Always made me feel so free Free as a bird It's the next best thing to be Free as a bird Free as a bird Free as a bird Free"
"the-beatles","run_for_your_life","rock","Well I'd rather see you dead, little girl Than to be with another man You better keep your head, little girl Or I won't know where I am You better run for your life if you can, little girl Hide your head in the sand little girl Catch you with another man That's the end, little girl Well I know that I'm a wicked guy And I was born with a jealous mind And I can't spend my whole life Trying just to make you toe the line You better run for your life if you can, little girl Hide your head in the sand little girl Catch you with another man That's the end, little girl Let this be a sermon I mean everything I've said Baby, I'm determined And I'd rather see you dead You better run for your life if you can, little girl Hide your head in the sand little girl I catch you with another man That's the end, little girl I'd rather see you dead, little girl Than to be with another man You better keep your head, little girl Or you won't know where I am You better run for your life if you can, little girl Hide your head in the sand little girl Catch you with another man That's the end, little girl Na, na, na Na, na, na Na, na, na Na, na, na"
"the-beatles","thatll_be_the_day","rock","Well that'll be the day when you say goodbye Yeah that'll be the day when you make me cry Ah, you say you're gonna leave, you know it's a lie 'Cause that'll be the day when I die Well you give me all your loving and all your turtledove-ing All your hugs and kisses and your money too You say you love me baby and still you tell me baby That someday well I'll be through 'Cause that'll be the day when you make me cry Ah, that'll be the day when you say goodbye You say you're gonna leave, you know it's a lie 'Cause that'll be the day when I die The honky tonk! Yeah that'll be the day when you say goodbye Yeah that'll be the day when you make me cry Ah, you say you're gonna leave, you know it's a lie 'Cause that'll be the day when I die Well when Cupid shot his dart, he shot it at your heart So if we'll ever part and I'll leave too And you say you'll call me and you tell me boldly That some day well I'll be through 'Cause that'll be the day when you say goodbye Yeah that'll be the day when you make me cry Ah, you say you're gonna leave, you know it's a lie 'Cause that'll be the day when I die Yeah that'll be the day, hoo hoo That'll be the day, hoo hoo That'll be the day, hoo hoo That'll be the day"
"the-beatles","riding_on_a_bus","rock","The Beatles Miscellaneous Riding on a Bus Brian Matthew: Before we hear another song, fellows, there is a few things I'd like to ask you. First of all, do you ever get tired of being Beatles?  Paul: We don't think so, really. Brian: You don't ever think that? Paul: Just occasionally, you get cheesed off with people writing rubbing about you, which you get often. John: Yeah, I agree with that. I've had a divorce and half a dozen kids. Brian: Now, what do you, eh, well, I mean, doesn't, isn't this a big sort of drag to go around explaining to your wife that you're not divorced and all that sort of things? John: No, she knows I'm not divorced, 'cause I keep seeing her every day, you see. Brian: Yes, a point, but what about the simpler things of life, like, eh--\" Paul: Like riding a bus? Brian: Yeah, or going to just about any restaurant you-- Paul: Well, yeah, you miss those sort of things. John: We go to certain ones. George: And we go to ones where the people there are so snobby, they're the type who pretend they don't know us, so we have a good time, 'cause they pretend they don't know us. Paul: Joe's CafÈ! Brian: Yeah, that figures. Paul: Joe's CafÈ! Social statement, that, you know. George: It is."
"the-beatles","blue_jay_way","rock","There's a fog upon L.A. And my friends have lost their way ‚ÄΩWe'll be over soon‚Äù they said Now they've lost themselves instead Please don't be long Please don't you be very long Please don't be long Or I may be asleep Well it only goes to show And I told them where to go Ask a policeman on the street There's so many there to meet Please don't be long Please don't you be very long Please don't be long Or I may be asleep Now it's past my bed I know And I'd really like to go Soon will be the break of day Sitting here in Blue Jay Way Please don't be long Please don't you be very long Please don't be long Or I may be asleep Please don't be long Please don't you be very long Please don't be long Please don't be long Please don't you be very long Please don't be long Please don't be long Please don't you be very long Please don't be long Don't be long Don't be long Don't be long Don't be long Don't be long Don't be long Don't be long"
"the-beatles","the_night_before","rock","We said our goodbyes, ah, the night before Love was in your eyes, ah, the night before Now today I find you have changed your mind Treat me like you did the night before Were you telling lies, ah, the night before? Was I so unwise, ah, the night before? When I held you near you were so sincere Treat me like you did the night before Last night is a night I will remember you by When I think of things we did it makes me wanna cry We said our goodbye, ah, the night before Love was in your eyes, ah, the night before Now today I find you have changed your mind Treat me like you did the night before When I held you near you were so sincere Treat me like you did the night before Last night is a night I will remember you by When I think of things we did it makes me wanna cry Were you telling lies, ah, the night before? Was I so unwise, ah, the night before? When I held you near you were so sincere Treat me like you did the night before Like the night before"
"the-beatles","do_you_want_to_know_a_secret","rock","You'll never know how much I really love you You'll never know how much I really care Listen Do you want to know a secret? Do you promise not to tell? Closer Let me whisper in your ear Say the words you long to hear I'm in love with you Listen Do you want to know a secret? Do you promise not to tell? Closer Let me whisper in your ear Say the words you long to hear I'm in love with you I've known a secret for a week or two Nobody knows Just we two Listen Do you want to know a secret? Do you promise not to tell? Closer Let me whisper in your ear Say the words you long to hear I'm in love with you"
"the-beatles","the_fool_on_the_hill","rock","Day after day Alone on a hill The man with the foolish grin Is keeping perfectly still But nobody wants to know him They can see that he's just a fool And he never gives an answer But the fool on the hill Sees the sun going down And the eyes in his head See the world spinning round Well on the way Head in a cloud The man of a thousand voices Talking perfectly loud But nobody ever hears him Or the sound he appears to make And he never seems to notice But the fool on the hill Sees the sun going down And the eyes in his head See the world spinning round And nobody seems to like him They can tell what he wants to do And he never shows his feelings But the fool on the hill Sees the sun going down And the eyes in his head See the world spinning round Oh, round, an' round, an' round, an' round, an' round He never listens to them He knows that they're the fools They don't like him The fool on the hill Sees the sun going down And the eyes in his head See the world spinning round Oh, round, an' round, an' round, an' round Oh"
"the-beatles","lucy_in_the_sky_with_diamonds","rock","Picture yourself in a boat on a river With tangerine trees and marmalade skies Somebody calls you, you answer quite slowly A girl with kaleidoscope eyes Cellophane flowers of yellow and green Towering over your head Look for the girl with the sun in her eyes And she's gone Lucy in the sky with diamonds Lucy in the sky with diamonds Lucy in the sky with diamonds, ah Follow her down to a bridge by a fountain Where rocking horse people eat marshmallow pies Everyone smiles as you drift past the flowers That grow so incredibly high Newspaper taxies appear on the shore Waiting to take you away Climb in the back with your head in the clouds And you're gone Lucy in the sky with diamonds Lucy in the sky with diamonds Lucy in the sky with diamonds, ah Picture yourself in a train in a station With plasticine porters with looking glass ties Suddenly someone is there at the turnstile The girl with kaleidoscope eyes Lucy in the sky with diamonds Lucy in the sky with diamonds Lucy in the sky with diamonds, ah Lucy in the sky with diamonds Lucy in the sky with diamonds Lucy in the sky with diamonds, ah Lucy in the sky with diamonds Lucy in the sky with diamonds Lucy in the sky with diamonds"
"the-beatles","michelle","rock","Michelle, ma belle These are words that go together well My Michelle Michelle, ma belle Sont des mots qui vont tres bien ensemble Tres bien ensemble I love you, I love you, I love you That's all I want to say Until I find a way I will say the only words I know that you'll understand Michelle, ma belle Sont des mots qui vont tres bien ensemble Tres bien ensemble I need to, I need to, I need to I need to make you see Oh, what you mean to me Until I do I'm hoping you will know what I mean I love you I want you, I want you, I want you I think you know by now I'll get to you somehow Until I do I'm telling you so you'll understand Michelle, ma belle Sont des mots qui vont tres bien ensemble Tres bien ensemble And I will say the only words I know that you'll understand My Michelle"
"the-beatles","while_my_guitar_gently_weeps","rock","I look at you all see the love there that's sleeping While my guitar gently weeps I look at the floor and I see it needs sweeping Still my guitar gently weeps I don't know why nobody told you How to unfold your love I don't know how someone controlled you They bought and sold you I look at the world and I notice it's turning While my guitar gently weeps With every mistake we must surely be learning Still my guitar gently weeps I don't know how you were diverted You were perverted too I don't know how you were inverted No one alerted you I look at you all see the love there that's sleeping While my guitar gently weeps I look at you all Still my guitar gently weeps"
"the-beatles","love_me_do","rock","Love, love me do You know I love you I'll always be true So please, love me do Whoa, love me do Love, love me do You know I love you I'll always be true So please, love me do Whoa, love me do Someone to love Somebody new Someone to love Someone like you Love, love me do You know I love you I'll always be true So please, love me do Whoa, love me do Love, love me do You know I love you I'll always be true So please, love me do Whoa, love me do Yeah, love me do Whoa, love me do Yeah, love me do"
"the-beatles","with_a_little_help_from_my_friends","rock","What would you think if I sang out of tune Would you stand up and walk out on me? Lend me your ears and I'll sing you a song And I'll try not to sing out of key Oh, I get by with a little help from my friends Mmm, I get high with a little help from my friends Mmm, gonna try with a little help from my friends What do I do when my love is away Does it worry you to be alone? How do I feel by the end of the day Are you sad because you're on your own? No, I get by with a little help from my friends Mmm, get high with a little help from my friends Mmm, gonna try with a little help from my friends Do you need anybody? I need somebody to love Could it be anybody? I want somebody to love Would you believe in a love at first sight? Yes, I'm certain that it happens all the time What do you see when you turn out the light? I can't tell you but I know it's mine Oh, I get by with a little help from my friends Mmm, get high with a little help from my friends Oh, I'm gonna try with a little help from my friends Do you need anybody? I just need someone to love Could it be anybody? I want somebody to love Oh, I get by with a little help from my friends Mmm, gonna try with a little help from my friends Oh, I get high with a little help from my friends Yes, I get by with a little help from my friends With a little help from my friends"
"the-beatles","yesterday","rock","Yesterday, all my troubles seemed so far away Now it looks as though they're here to stay Oh, I believe in yesterday Suddenly, I'm not half the man I used to be There's a shadow hanging over me Oh, yesterday came suddenly Why she had to go I don't know, she wouldn't say I said something wrong Now I long for yesterday Yesterday, love was such an easy game to play Now I need a place to hide away Oh, I believe in yesterday Why she had to go I don't know, she wouldn't say I said something wrong Now I long for yesterday Yesterday, love was such an easy game to play Now I need a place to hide away Oh, I believe in yesterday"
"the-beatles","act_naturally","rock","They're gonna put me in the movies They're gonna make a big star out of me We'll make a film about a man that's sad and lonely And all I gotta do is act naturally Well, I'll bet you I'm gonna be a big star Might win an Oscar, you can never tell The movies gonna make me a big star 'Cause I can play the part so well Well I hope you'll come and see me in the movies Then I'll know that you will plainly see The biggest fool that ever hit the big time And all I gotta do is act naturally We'll make the scene about a man that's sad and lonely And beggin' down upon his bended knee I'll play the part but I won't need rehearsing All I have to do is act naturally Well, I'll bet you I'm gonna be a big star Might win an Oscar you can never tell The movies gonna make me a big star 'Cause I can play the part so well Well I hope you'll come and see me in the movies Then I'll know that you will plainly see The biggest fool that ever hit the big time And all I gotta do is act naturally"
"the-beatles","strawberry_fields_forever","rock","Let me take you down ‚Ä~Cause I'm going to Strawberry Fields Nothing is real And nothing to get hung about Strawberry Fields forever Living is easy with eyes closed Misunderstanding all you see It's getting hard to be someone But it all works out It doesn't matter much to me Let me take you down ‚Ä~Cause I'm going to Strawberry Fields Nothing is real And nothing to get hung about Strawberry Fields forever No one I think is in my tree I mean it must be high or low That is you can't, you know, tune in But it's all right That is I think it's not too bad Let me take you down ‚Ä~Cause I'm going to Strawberry Fields Nothing is real And nothing to get hung about Strawberry Fields forever Always, no sometimes, think it's me But you know I know when it's a dream I think I know I mean a yes But it's all wrong That is I think I disagree Let me take you down ‚Ä~Cause I'm going to Strawberry Fields Nothing is real And nothing to get hung about Strawberry Fields forever Strawberry Fields forever Strawberry Fields forever"
