"the-beatles","rip_it_upshake_rattle_and_rollblue_suede_shoes","rock","I don't care if I spent my dough  night gonna be [...]  Gonna rock it up,  gonna shake it up,  gonna roll it up,  have 'em ball tonight.  Rattle and roll,  I said shake rattle and roll,  Well you never done nothing  to save your doggone soul.  Well get out of that kitchen  and shake those pots and pans.  I said get out of that kitchen  and shake those pots and pans.  I said to my soul:  you're the devil in a frying pan.  Well I said shake rattle and roll,  I said shake rattle and roll,  I said shake rattle and roll,  I said shake rattle and roll.  Well you never done nothing  to save your doggone soul.  You can knock me down,  slap my face,  slander my name  all over the place.  Do anything that you want to do,  but oh oh honey,  lay off of them shoes.  Now don't you step  on my blue suede shoes.  Well you can do anything  but lay off of them blue suede shoes.  Ah go!  You can burn my house,  steal my car,  drink my liquor  from an old fruit jar.  Do anything  that you want to do,  but ah ah honey,  lay off of them shoes.  And don't you step  on my blue suede shoes, please.  Well you can do anything  but lay off of them blue suede shoes.  Ah go, hit it, Carl [Perkins]!  Well blue blue,  blue suede shoes.  Yeah blue blue,  blue suede shoes.  Babe blue blue,  blue suede shoes.  Yeah brown brown  brown suede boots.  Well do anything  but lay off of them blue suede shoes."
"the-beatles","rocky_raccoon","rock","Now somewhere in the black mountain hills of Dakota There lived a young boy named Rocky Raccoon And one day his woman ran off with another guy He hit young Rocky in the eye Rocky didn't like that he said I'm gonna get that boy So one day he walked into town Booked himself a room in the local saloon Rock Raccoon checked into his room Only to find Gideon's bible Rocky had come equipped with a gun To shoot off the legs of his rival His rival it seems had broken his dreams By stealing the girl of his fancy Her name was Magill and she called herself Lil But everyone knew her as Nancy Now she and her man, who called himself Dan Were in the next room at the hoedown Rocky burst in and grinning a grin He said, ‚ÄΩDanny boy this is a showdown‚Äù But Daniel was hot he drew first and shot And Rocky collapsed in the corner Now the doctor came in stinking of gin And proceeded to lie on the table He said, ‚ÄΩRocky you met your match‚Äù And Rocky said, ‚ÄΩDoc it's only a scratch And I'll be better, I'll be better Doc as soon as I am able‚Äù And now Rocky Raccoon he fell back in his room Only to find Gideon's bible Gideon checked out and he left it no doubt To help with good Rocky's revival"
"the-beatles","the_saints","rock","The Beatles Miscellaneous The Saints Well a-when the saints go marching in,  when the saints go marching in  mm I want to be, I'm gonna be in that number,  ooo when the saints go marching in.  Oh when the sun yeah begins to shine.  when that old sun begins to shine,  I tell you something I'm gonna be I'm gonna be in that number,  when the sun begins to shine.  Yeah when my lord calls me home again,  ah when my lord calls me home again,  I'll tell you I'm gonna be in that number,  oh when my lord calls me home again.  Oh when the saints go marching in,  when the saints go marching in  I tell you something I'm gonna be I'm gonna be in that number,  when the saints go marching in.  Well when the sun yeah begins to shine.  when that sun begins to shine,  I tell you something I'm gonna be I'm gonna be in that number,  when that old sun begins to shine.  Lazy one time.  Mm mm, yeh, alright, mm, yeah,  ooo when the saints go marching in.  Yeah when the saints go marching in,  yeah when the saints go marching in  I tell you something, I'm gonna be I'm gonna be in that number,  yeah when the saints go marching in.  Yeah when my lord calls me home again,  ah when my lord calls me home again,  I'll tell you I'm gonna be in that number,  oh when the saints go marching in."
"the-beatles","the_sheik_of_araby","rock","Well I'm the Sheik of Araby Your love belongs to me Well at night when you're asleep Into your tent I'll creep The stars that shine above Will light our way to love You rule this world with me I'm the Sheik of Araby Well I'm the Sheik of Araby Your love belongs to me Oh at night when you're asleep Into your tent I'll creep The sun that shines above Will light our way to love You rule this world with me I'm the Sheik of Araby Well I'm the Sheik of Araby Well I'm the Sheik of Araby, yeah"
"the-beatles","so_how_come_no_one_loves_me","rock","They say that everyone wants someone So how come no one wants me? Then they say that everyone needs someone So how come no one needs me? Well, if you wonder who the loneliest Creatures IN the world can be Well, there's the Ugly Duckling The Little Black Sheep, and me, uh-huh They say that everyone loves someone So how come no one loves me? Well, if you wonder who the loneliest Creatures in the world can be Well, there's the Ugly Duckling The Little Black Sheep, and me, uh-huh They say that everyone loves someone So how come no one loves me? So how come no one loves me? So how come no one loves me?"
"the-beatles","soldier_of_love","rock","The Beatles Miscellaneous Soldier Of Love Lay down your arms of love  and surrender to me.  Lay down your arms of love  and love me peacefully, yeah.  Use your arms for loving me,  baby that's the way it's got to be.  There ain't no reason for you to be bad  for you're the woman and I love you so.  So forget the other boys, 'cos my love is real,  come off your battlefield.  Lay down your arms of love,  and love me peacefully.  Lay down your arms of love  and love me tenderly, yeah.  Use your arms for hold me tight,  Baby I don't want to fight no more  The weapons you're using  are hurting me bad,  and someday you're gonna see,  'cos my love for you baby,  is the truest you've ever had.  A soldier of love is hard to be.  Lay down your arms of love,  and let the peacefully.  Lay down your arms of love  and surrender to me, yeah.  Use your arms for squeezing,  and please the one that you want to hold.  Soldier of love,  baby lay down your arms,  soldier of love,  baby lay down your arms."
"the-beatles","some_other_guy","rock","Ow! Some other guy, now, has taken my love away from me, oh now Some other guy, now, has taken away my sweet desire, oh now Some other guy, now, I just don't wanna hold my hand, oh now I'm the lonely one as lonely as I can feel, all right Some other guy is sippin' up the honey like a yellow dog, oh now Some other guy, now, has taken my love just like I'm gone, oh now Some other guy, now, has taken my love away from me, oh now I'm the lonely one as lonely as I can feel, all right now, whoa whoa ho ho Some other guy, is makin' me very very mad, oh now Some other guy, now, is makin' my past seem oh so bad, oh now Some other guy, now, she was the first girl I've ever had, oh now I'm the lonely one as lonely as I can feel, all right now, whoa whoa ho ho I'm a-talkin' to you, right now Hey! Ow!"
"the-beatles","sun_king","rock","Here comes the sun king Here comes the sun king Everybody's laughing Everybody's happy Here comes the sun king Quando para mucho mi amore de felice corazon Mundo paparazzi mi amore chica ferdi parasol Questo abrigado tanta mucho que canite carousel"
"the-beatles","sweet_georgia_brown","rock","Well, let me tell you Well, no chick made could be the same as sweet Georgia Brown Crazy feet that dance so neat as sweet Georgia Brown Fellas sigh, and even cry for sweet Georgia Brown I tell you just why, you know I don't lie It's been said she knocks ‚Ä~em dead in any old town Since she came right it's a shame how she brings ‚Ä~em down In Liverpool she even dared to criticize the Beatles' hair With their whole fan club standing there, I mean sweet Georgia Brown I say this group is absolutely marvelous with the piano Don't you think so? Not too commercial, boys, not too commercial! When it comes to music sweet Georgia is known to mind Don't buy clothes at fashion shows but she still looks fine Snap chicks cry, they want to die when Georgie does the twist I never would try to tell you just why, use your imagination There's a DJ crazy for her living in our hometown Since she came it's a shame she turns him down Records that she can get are records they ain't sent him yet Carolina may have Dina but that don't have Georgia Brown Oh, that sweet Georgia Yeah yeah yeah, I mean Brown Oh oh oh, sweet Georgia Brown"
"the-beatles","sweet_little_sixteen","rock","They're really rocking in Boston,  in Philadelphia PA,  deep in the heart of Texas,  on down the Frisco Bay.  All over Saint Louis  and down in New Orleans.  All the cats want to dance with  sweet little sixteen.  Sweet little sixteen,  she's just got to have  about half a million  framed autopraphs.  Her wall is filled with pictures,  she gets them one by one.  Becomes so excited,  oh watch her at the run boy.  Oh mommy mommy,  please may I go.  You know it's such a sight to see  somebody steal the show.  Oh daddy daddy,  I beg of you.  Please say it to mommy  it's alright with you.  Sweet little sixteen  she's got the grown up blues.  Tight dresses and lipstick,  she's sporting in high heeled boots.  Oh but tomorrow morning  she'll have to change her trend  become sweet sixteen  and back in class again.  They're really rocking in Boston,  in Philadelphia PA,  deep in the heart of Texas  and down the Frisco Bay.  All over Saint Louis,  on down in New Orleans.  All the cats want to dance with  sweet little sixteen"
"the-beatles","tell_me_why","rock","Tell me why you cried And why you lied to me Tell me why you cried And why you lied to me Well I gave you everything I had But you left me sitting on my own Did you have to treat me oh so bad? All I do is hang my head and moan Tell me why you cried And why you lied to me Tell me why you cried And why you lied to me And if something I have said or done Tell me what and I'll apologize If you don't I really can't go on Holding back these tears in my eyes Tell me why you cried And why you lied to me Tell me why you cried And why you lied to me Well I'm beggin' on my bended knees If you'll only listen to my pleas Is there anything I can do? 'Cause I really can't stand it I'm so in love with you Tell me why you cried And why you lied to me Tell me why you cried And why you lied to me"
"the-beatles","three_cool_cats","rock","Three cool cats Three cool cats A-hung on the corner in a beat up car Splitting up a nip of candy bar Talking all about how sharp they are These three cool cats Three cool chicks Are walking down the street swinging their hips Splitting up a bag of potato chips And three cool cats did three big flips for Three cool chicks Yeah, three cool chicks Well up popped that first cool cat He said, \"Man, look at that! Man, do you see what I see?‚Äù ‚ÄΩWell, I want that middle chick!\" \"I want that little chick!\" \"Hey, man save one chick for me!\" Well, three cool chicks Three cool chicks Well, they looked like angels from up above And three cool cats really fell in love But three cool chicks made three fools of Those three cool cats Three cool cats Well, up popped that first cool cat He said \"Man look at that! Man, do you see what I see?‚Äù ‚ÄΩWell, now I want that middle chick!\" \"I want that little chick!\" \"Hey, man save one chick for me!\" Three cool chicks Three cool chicks They looked like angels from up above And three cool cats really fell in love But three cool chicks made three fools of These three cool cats Three cool cats Three cool cats Three cool cats"
"the-beatles","to_know_her_is_to_love_her","rock","To know know know her Is to love love love her Just to see her smile Makes my life worthwhile Yes, just to know know know her Is to love love love her And I do (And I do and I) And I do (And I do and I) And I do (And I do and I da da da, da da da) I'll be good to her I'll make love to her Everyone says there'll come a day When I'll walk alongside of her Yes, just to know know know her Is to love love love her And I do (And I do and I) And I do (And I do and I) (And I do and I, and I do and I) Why can't she see? How blind can she be? Someday she'll see That she was meant just for me, oh oh yeah To know know know her Is to love love love her Just to see her smile Makes my life worthwhile Yes, just to know know know her Is to love love love her And I do (And I do and I, and I do and I) (And I do and I, and I do and I) Why can't she see? How blind can she be? Someday she'll see That she was meant just for me, oh oh yeah To know know know her Is to love love love her Just to see her smile Makes my life worthwhile Yes, just to know know know her Is to love love love her And I do (And I do and I) And I do, and I do, and I do (And I do and I do)"
"the-beatles","tomorrow_never_knows","rock","Turn off your mind, relax And float down stream It is not dying It is not dying Lay down all thought Surrender to the void It is shining It is shining That you may see The meaning of within It is being It is being That love is all And love is everyone It is knowing It is knowing That ignorance and hate May mourn the dead It is believing It is believing But listen to the Color of your dreams It is not living It is not living Or play the game Existence to the end Of the beginning Of the beginning Of the beginning Of the beginning Of the beginning Of the beginning Of the beginning"
"the-beatles","too_much_monkey_business","rock","Running to and fro,  hard working at the mill,  never failed at the mill,  there come a rotten bill.  Aw too much monkey business,  too much monkey business,  too much monkey business  for me to be involved again.  Salesman talking to me,  trying to run me up a creek,  Says you can buy it, go on try it,  you can pay me next week.  Aw too much monkey business,  too much monkey business,  too much monkey business  for me to be involved again.  Blonde hair, good-looking,  trying to get me hooked and married  Get a home, settle down by the book.  Too much monkey business,  too much monkey business,  too much monkey business  for me to be involved again.  Been to Yokohama, baby,  fighting in the war,  Army bunk, army chow,  army clothes, army car.  Too much monkey business,  too much monkey business,  too much monkey business  for me to be involved again.  Same thing every day,  getting up, going to school.  No need for me complaining,  my objection's overruled.  Aw too much monkey business,  too much monkey business,  too much monkey business  for me to be involved again.  Working in the filling station,  too many tasks,  Wipe the windows, check the oil,  check the tires, dollar gas?  Aw too much monkey business,  too much monkey business  Don't want you by the race,  get away and leave me.  [Original has one more verse:  Pay-phone, something's wrong,  dime gone, will mail.  Oughta sue the operator  for telling me a tale.  Too much monkey business,  too much monkey business,  too much monkey business  for me to be involved with you.]"
"the-beatles","why","rock","Why why can't we love again? Why why are you shy on love? If you only knew how much I love you Why can't you love me again? Why why don't you open your heart? Why why are we so far apart? If you only knew how much I love you Why can't you love me again? I just want your loving arms around me, yeah I got to find a way to make you take me back Baby won't you tell me Why why why why are we so far apart? Why why don't you open your heart? If you only knew how much I love you Why can't you love me again? I just want your loving arms around me, yeah I got to find a way to make you take me back Baby, won't you tell me Why why why why are we so far apart? Why why don't you open your heart? If you only knew how much I love you Why can't you love me? Why can't you love me? Why can't you love me again?"
"the-beatles","words_of_love","rock","Hold me close and tell me how you feel Tell me love is real Words of love you whisper soft and true Darling, I love you Let me hear you say the words I long to hear Darling, when you're near Words of love you whisper soft and true Darling, I love you"
"the-beatles","yes_it_is","rock","If you wear red tonight Remember what I said tonight For red is the color that my baby wore And what's more, it's true Yes it is Scarlet were the clothes she wore Everybody knows I'm sure I would remember all the things we planned Understand it's true Yes it is, it's true Yes it is I could be happy with you by my side If I could forget her, but it's my pride Yes it is, yes it is, oh, yes it is, yea Please don't wear red tonight This is what I said tonight For red is the color that will make me blue In spite of you, it's true Yes it is, it's true Yes it is I could be happy with you by my side If I could forget her, but it's my pride Yes it is, yes it is, oh, yes it is, yea Please don't wear red tonight This is what I said tonight For red is the color that will make me blue In spite of you, it's true Yes it is, it's true Yes it is, it's true"
"the-beatles","you_know_what_to_do","rock","When I see you I just don't know what to say I like to be with you Every hour of the day So if you want me Just like I need you You know what to do I watched you walking by And you looked alone I hope that you won't mind If I walk you back home But if you want me Just like I need you You know what to do Just call on me When you're lonely I'll keep my love For you only I'll call on you If I'm lonely too Understand I'll stay With you every day Make you love me more In every way So if you want me Just like I want you You know what to do Just call on me When you're lonely I'll keep my love For you only I'll call on you If I'm lonely too Understand I'll stay With you every day Make you love me more In every way So if you want me Just like I need you You know what to do"
"the-beatles","young_blood","rock","I saw her standing on the corner A yellow ribbon in her hair I couldn't stop myself from calling ‚ÄΩWhy look a-there, look a-there Why look a-there, why look a-there‚Äù Hey, young blood Oh young blood Hey, young blood I can't get you out of my mind I took one look and I was fractured I tried to walk but I was lame I tried to talk but I just stuttered ‚ÄΩWell, what's your name? What's your name? Well, what's your name? Well, what's your name?‚Äù Hey, young blood Hey, young blood Young blood I can't get you out of my mind What crazy stuff, she looked so tough I tried to follow her all the way home Well, things went bad, I met her dad He said, ‚ÄΩYou'd better leave my daughter alone‚Äù Well, I tried to speak but I just stuttered I saw the rising of the sun And all along my heart was calling ‚ÄΩWhy, you're the one, you're the one Why, you're the one, why, you're the one‚Äù Hey, young blood Oh, young blood Hey, young blood I can't get you out of my mind Hey, young blood Oh, young blood Hey, young blood I can't get you out of my mind"
"the-beatles","1822","rock","The Beatles Miscellaneous 1822! John: This is a Dorsey Burnette number, brother of Johnny Burnette, called \"Lonesome Tears in My Eyes,\" recorded on their very first LP in 1822! *all laugh* Ha!"
"the-beatles","a_little_help_from_my_friends_lennonmccartney","rock","The Beatles Miscellaneous A Little Help From My Friends (Lennon/McCartney) A little help from my friends What would you think if I sang out of tune, Would you stand up and walk out on me. Lend me your ears and I'll sing you a song, And I'll try not to sing out of key.  I get by with a little help from my friends, I get high with a little help from my friends, Going to try with a little help from my friends.  What do I do when my love is away. (Does it worry you to be alone) How do I feel by the end of the day (Are you sad because you're on your own) No I get by with a little help from my friends, Do you need anybody, I need somebody to love. Could it be anybody I want somebody to love. Would you believe in a love at first sight, Yes I'm certain that it happens all the time. What do you see when you turn out the light, I can't tell you, but I know it's mine. Oh I get by with a little help from my friends, Do you need anybody, I just need somebody to love, Could it be anybody, I want somebody to love. I get by with a little help from my friends, Yes I get by with a little help from my friends, With a little help from my friends."
"the-beatles","a_taste_of_honey","rock","A taste of honey Tasting much sweeter Than wine I dream of your First kiss and then I feel upon My lips again A taste of honey (A taste of honey) Tasting much sweeter Than wine Oh, I will return Yes, I will return I'll come back For the honey and you Yours was the kiss That awoke my heart There lingers still Though we're far apart That taste of honey (A taste of honey) Tasting much sweeter Than wine Oh, I will return Yes, I will return I'll come back (He'll come back) For the honey (For the honey) And you"
"the-beatles","act_naturally","rock","They're gonna put me in the movies They're gonna make a big star out of me We'll make a film about a man that's sad and lonely And all I gotta do is act naturally Well, I'll bet you I'm gonna be a big star Might win an Oscar, you can never tell The movies gonna make me a big star 'Cause I can play the part so well Well I hope you'll come and see me in the movies Then I'll know that you will plainly see The biggest fool that ever hit the big time And all I gotta do is act naturally We'll make the scene about a man that's sad and lonely And beggin' down upon his bended knee I'll play the part but I won't need rehearsing All I have to do is act naturally Well, I'll bet you I'm gonna be a big star Might win an Oscar you can never tell The movies gonna make me a big star 'Cause I can play the part so well Well I hope you'll come and see me in the movies Then I'll know that you will plainly see The biggest fool that ever hit the big time And all I gotta do is act naturally"
"the-beatles","all_ive_got_to_do_beatlemania_with_the_beatles_album","rock","Whenever I want you around yeah All I gotta do Is call you on the phone And you'll come running home Yaeh that's all I gotta do And when I, I wanna kiss you yeah All I gotta do Is whisper in your ear The words you long to hear And I'll be kissing you And the same goes for me Whenever you want me at all I'll be here yes I will Whenever you call You just gotta call on me, yeah You just gotta call on me And when I, I wanna kiss you, yeah All I got to do Is call you on the phone And you'll come running how Yeah, that's all I gotta do And the same goes for me Whenever you want me at all I'll be here yes I will Whenever you call You just gotta call on me, yeah You just gotta call on me, oh You just gotta call on me Mmmmmmmmmm"
"the-beatles","all_my_loving_beatlemania_with_the_beatles_album","rock","Close your eyes and I'll kiss you Tomorrow I'll miss you Remember I'll always be true And then while I'm away I'll write home every day And I'll send all my loving to you I'll pretend that I'm kissing The lips I am missing And hope that my dreams will come true And then while I'm away I'll write home every day And I'll send all my loving to you All my loving I will send to you All my loving, darling I'll be true Close your eyes and I'll kiss you Tomorrow I'll miss you Remember I'll always be true And then while I'm away I'll write home every day And I'll send all my loving to you All my loving I will send to you All my loving, darling I'll be true All my loving, all my loving ooh All my loving I will send to you"
"the-beatles","any_time_at_all","rock","Any time at all Any time at all Any time at all All you gotta do is call And I'll be there If you need somebody to love Just look into my eyes I'll be there to make you feel right If you're feeling sorry and sad I'd really sympathize Don't you be sad, just call me tonight Any time at all Any time at all Any time at all All you gotta do is call And I'll be there If the sun has faded away I'll try to make it shine There is nothing I won't do When you need a shoulder to cry on I hope it will be mine Call me tonight and I'll come to you Any time at all Any time at all Any time at all All you gotta do is call And I'll be there Any time at all Any time at all Any time at all All you gotta do is call And I'll be there Any time at all All you gotta do is call And I'll be there"
"the-beatles","anything_starkey","rock","The Beatles Miscellaneous Anything (Starkey) (Instrumental)"
"the-beatles","ask_me_why","rock","I love you 'Cause you tell me things I want to know And it's true That it really only goes to show That I know That I, I, I, I Should never, never, never be blue Now you're mine My happiness dear makes me cry And in time You'll understand the reason why If I cry It's not because I'm sad But you're the only love that I've ever had I can't believe, it's happened to me I can't conceive of any more misery Ask me why, I'll say I love you And I'm always thinking of you I love you 'Cause you tell me things I want to know And it's true That it really only goes to show That I know That I, I, I, I Should never, never, never be blue Ask me why, I'll say I love you And I'm always thinking of you I can't believe, it's happened to me I can't conceive of any more misery Ask me why, I'll say I love you And I'm always thinking of you, you, you"
